User_name,Location_hotel,Hotel_name,Rating,Comment,Service,Infrastructure,Sanitary,Location,Attitude
Nguyen T. M. N.,Phú Quốc,Vinpearl Discovery Wonderworld Phú Quốc,10.0,hài_lòng dịch_vụ ivivu cám_ơn minh_ngọc,1,0,0,0,2
Nguyen C. T.,Hà Nội,MK Premier Boutique Hotel,7.0,bảo_vệ ban_đêm mặt khó_chịu hỗ_trợ check camera đem ví khách_sạn quên xe grab giang_hồ an_ninh ok lễ_tân bảo_vệ ban_ngày,1,1,1,0,0
Nguyen P. L.,Vũng Tàu,Khu nghỉ dưỡng Six Senses Côn Đảo,10.0,dịch_vụ tốt không_có_gì chê,1,0,0,0,2
Mai M.,Hồ Chí Minh,Khách sạn Cozrum Smart - First Target,6.4,yêu_cầu nhận_phòng trả_phòng muộn app không_thông_báo địa_điểm lưu_trú không_ai báo lưu_trú yêu_cầu dọn phòng 15 phút thu_xếp tệ phòng đi 1 lầu miêu_tả thang_máy hoàn_toàn không_hề báo đi hành_lý một_mình lôi đồ_đạc đi cầu_thang không_có nhân_viên hỗ_trợ,1,1,0,0,0
Nguyen T. N.,Đà Lạt,Khách Sạn LADALAT,10.0,khách_sạn phục_vụ tốt hài_lòng,1,0,0,0,2
Nguyen T. T. H.,Phan Thiết,Seahorse Resort & Spa Phan Thiết,10.0,ăn ngon nhân_viên phục_vụ tốt,1,0,0,0,2
Tran T. M. T.,Phan Thiết,Seahorse Resort & Spa Phan Thiết,10.0,phòng đẹp chất_lượng tốt nhân_viên khách_sạn ivivu ok,1,1,0,0,2
Nguyen Q. T.,Phan Thiết,Khu nghỉ dưỡng Muine Bay Phan Thiết,8.0,chất_lượng tốt ổn ưng_ý vừa_rồi tin_tưởng dịch_vụ ivivu hỗ_trợ tốt nhanh_chóng,1,1,1,0,2
Nguyen T. N. T.,Vũng Tàu,Minera Hot Springs Bình Châu (Khoáng Nóng Thiên Nhiên Bình Châu),9.5,chuyến đi ok tốt,1,1,1,0,2
Nguyen V. H.,Phan Thiết,Seahorse Resort & Spa Phan Thiết,8.0,tốt nhân_viên bảo_vệ quan_sát bãi biển lo ngại không_muốn bảo_vệ lo_lắng tắm biển không_thoải_mái nói_chung an_toàn sạch_sẽ ăn_uống vừa_miệng chúc khu_nghỉ_mát mùa dịch covid 19,1,0,1,1,2
Luong T. H.,Phan Thiết,Seahorse Resort & Spa Phan Thiết,10.0,khu_nghỉ_mát đẹp dịch_vụ tốt nhân_viên ok,1,1,0,0,2
Tran T. N.,Đà Nẵng,Khu nghỉ dưỡng Melia Đà Nẵng Beach,9.0,khuôn_viên rộng gọi xe di_chuyển hơi nhận_phòngtrả_phòng thời_gian đông đồ ăn gọi,1,1,0,0,1
Le N. T.,Nha Trang,Khu nghỉ dưỡng Movenpick Cam Ranh,10.0,khu nghỉ_dưỡng sạch_đẹp nhân_viên lễ_phép hỗ_trợ nhiệt_tình chúng_tôi xếp 2 phòng phòng kết_nối thuận_tiện hỗ_trợ nhận_phòng đồ ăn ngon đa_dạng,1,1,1,0,2
Dang T. T.,Phan Thiết,Khu nghỉ dưỡng Muine Bay Phan Thiết,9.0,không_gian khu_nghỉ_mát ok vị_trí hơi khu_nghỉ_mát đồi hồng tiện đi_lại vui_chơi ăn thiên món ăn phương_tây ăn không_quen thức_ăn ngon hài_lòng khu_nghỉ_mát,1,1,0,1,2
Nguyen T. L.,Quy Nhơn,Muong Thanh Quy Nhon Hotel,9.1,khách_sạn không_còn sạch_sẽ nhân_viên phục_vụ nhiệt_tình thân_thiện,1,1,1,0,2
Phan T. T. H.,Đà Nẵng,Khách sạn A La Carte Đà Nẵng,10.0,lịch_sự thân_thiện,1,0,0,0,2
Nguyen H. N.,Hội An,Lasenta Boutique Hotel Hoian,9.4,không_gian đẹp sạch_sẽ nhân_viên nhiệt_tình,1,1,1,0,2
Nguyen T. T. T.,Phú Quốc,Khu nghỉ dưỡng Premier Village Phu Quoc Managed By Accor,10.0,khách_sạn đẹp nhân_viên phục_vụ tốt hài_lòng,1,1,0,0,2
Nguyen T. L. H.,Quy Nhơn,Khu nghỉ dưỡng Crown Retreat Quy Nhơn,8.0,gọi món ăn nhà_hàng không_hiểu lắm mượn 2 tô sử_dụng chờ 1 tiếng gọi nhắc 2 vấn_đề phòng đẹp nhìn_chung phục_vụ ok,1,1,0,0,1
Nguyen M. T.,Nha Trang,Khu nghỉ dưỡng Vinpearl Nha Trang,8.0,hôm nhận_phòng phòng mặc_dù đơn phòng ivivu tiền phụ_thu nhân_viên lễ_tân bắt đóng tiền điện ivivu cảm_ơn ivivu giải_quyết kịp_thời tiền đi trời mưa chẳng vui_chơi hài_lòng phục_vụ nhân_viên ivivu nhanh_chóng kịp_thời khu nghỉ_dưỡng phòng_ốc ổn không_còn phàn_nàn,1,1,0,0,2
Huynh T. H.,Phú Quốc,Vinpearl Resort & Spa Phú Quốc,10.0,dịch_vụ khách_sạn ok nhân_viên ivivu hỗ_trợ nhiệt_tình,1,0,0,0,2
Le T. T.,Phan Thiết,Khu nghỉ dưỡng Muine Bay Phan Thiết,10.0,bãi biển đẹp sạch hồ bơi đi kèm pool bar tiện_lợi đồ_ăn ngon thích_hợp đi nghỉ dưỡng gia_đình ăn hơi món ngon,1,1,0,1,2
Pham T. Q.,Phan Thiết,Khu nghỉ dưỡng Muine Bay Phan Thiết,10.0,dịch_vụ ok nhân_viên nhiệt_tình chuyến đi hài_lòng,1,0,0,0,2
Le T. T.,Đà Nẵng,Angel Hotel Danang,9.7,phòng đẹp nhân_viên dễ_thương khách_sạn sát biển đồ ăn ngon,1,1,0,1,2
Ngoc T. N.,Hồ Chí Minh,The Noble Swan Woodpark Hotel,9.4,ổn nhân_viên thân_thiện dễ_chịu,1,0,0,0,2
Phuong P.,Hà Nội,MK Premier Boutique Hotel,10.0,nhân_viên thân_thiện phòng đẹp dịch_vụ tốt,1,1,0,0,2
Nguyen T. T. T.,Quy Nhơn,Khu nghỉ dưỡng Crown Retreat Quy Nhơn,10.0,khu nghỉ_dưỡng phục_vụ tốt chất_lượng phòng ok,0,1,0,0,2
Nguyen H. L.,Quy Nhơn,Khu nghỉ dưỡng Crown Retreat Quy Nhơn,10.0,dịch_vụ ok chúng_tôi chuyến đi hài_lòng,1,0,0,0,2
Le M. T.,Phan Thiết,Seahorse Resort & Spa Phan Thiết,7.0,thức_ăn trưatối không_đa_dạng 2 đêm thực_chất gia_đình muỗi,1,0,1,0,0
Thi N. A. N.,Hội An,TTC Hotel - Hoi An,8.5,khách_sạn phố cổ không_xa hồ bơi rộng nhân_viên thân_thiện,1,1,0,1,2
Nguyen T. T. T.,Phan Thiết,Sea Links Beach Villas Phan Thiết,9.0,tất_cả ổn cơ_sở_vật_chất thoải_mái tiện_lợi nhân_viên nhiệt_tình thân_thiện,1,1,1,0,2
Thi T. H. N.,Huế,The Sunriver Boutique Hotel Hue,6.0,trải_nghiệm đề_xuất phòng bẩn gầm giường nguyên rác bàn bẩn nhân_viên không_nhiệt_tình vui_vẻ trải_nghiệm chán,1,1,1,0,0
Le H. T.,Phú Quốc,Khu nghỉ dưỡng Fusion Phú Quốc,10.0,hài_lòng đi vui tiếp_tục đồng_hành ivivu chuyến đi,0,0,0,0,2
Nguyen V. T.,Đà Nẵng,Khách sạn Four Points by Sheraton Đà Nẵng,10.0,nhân_viên tư_vấn ivivu huy hỗ_trợ tư_vấn tốt khách_sạn ok,1,1,0,0,2
Nguyen T. K. A.,Quy Nhơn,Muong Thanh Quy Nhon Hotel,8.5,sạch_sẽ nhân_viên thân_thiện,1,0,1,0,2
Bui T. H.,Phú Quốc,Radisson Blu Resort Phu Quoc,10.0,khách_sạn xứng tầm 5 không_có_gì chê,0,1,0,0,2
Le H. T.,Phú Quốc,The Palmy Phú Quốc Resort & Spa,9.4,không_để_ý nội_thất phòng khu_nghỉ_mát thoải_mái hồ bơi vô_cực lầu 8 chụp hình đẹp buffet tương_đối món ăn ổn gọi điện lễ_tân phục_vụ ok,1,1,0,0,2
Nguyen T. N.,Đà Nẵng,Angel Hotel Danang,6.1,chăm_sóc khách_hàng kém phòng hôi chăn ga hôi đồ_dùng cũ,1,1,1,0,0
Nguyen T. K. T.,Đà Nẵng,Meliã Vinpearl Đà Nẵng Riverfront,10.0,khách_sạn ok hài_lòng phục_vụ chu_đáo nhiệt_tình,1,1,0,0,2
Nguyen T. H.,Hồ Chí Minh,Ruby Saigon Hotel,6.1,phòng_ốc nhân_viên tệ khách_sạn không_thân_thiện khách_hàng,1,1,0,0,0
Minh T.,Hồ Chí Minh,Ruby Saigon Hotel,6.0,phòng nhân_viên lễ_tân không_thực_sự thân_thiện thái_độ chúng_tôi đặc_biệt trung_tâm blessing 1 đường 48 nguyễn_an_ninh chợ bến_thành bữa ăn không_thực_sự tốt_đẹp tất_cả kế_hoạch không_có hương_vị yêu_cầu thay_đổi phòng nhân_viên tiếp_tân thái_độ không_phải tiền,1,1,0,0,0
Nguyen T. P. T.,Nha Trang,Khu nghỉ dưỡng Amiana Nha Trang,10.0,hài_lòng khu nghỉ_dưỡng dịch_vụ tốt phòng đẹp khuôn_viên rộng nhân_viên ivivu hỗ_trợ nhanh_chóng chu_đáo,1,1,0,0,2
Nguyen A. D.,Nha Trang,Khu nghỉ dưỡng Vinpearl Nha Trang,10.0,khách_sạn ổn nhân_viên chu_đáo tận_tình,1,1,0,0,2
Nguyen T. T.,Hà Nội,Hanoi Charming House,10.0,phòng sạch_sẽ phục_vụ nhiệt_tình,1,0,1,0,2
Nguyen T. K. T.,Đà Nẵng,Khu nghỉ dưỡng Núi Thần Tài Ebisu Đà Nẵng,10.0,chuyến đi tốt_đẹp ổn,1,1,1,0,2
Giang G.,Hạ Long,The Bay - Ha Long Homestay,9.7,phòng đẹp sạch_sẽ thuê xe_máy tiện lém anh_chị chủ dễ_thương thân_thiện đánh_giá,1,1,1,0,2
Nguyen X. T.,Vũng Tàu,Oceanami Villas & Beach Club,9.7,phục_vụ cảnh,1,0,0,0,2
Nguyen T. T.,Quy Nhơn,Khu nghỉ dưỡng Crown Retreat Quy Nhơn,8.0,phòng đẹp nhà_vệ_sinh xấu đơn_điệu không_được sang_trọng phòng biển sóng biển ầm_ầm dịch_vụ ok lắm,1,1,0,1,1
Ho T. V.,Quy Nhơn,Casa Marina Resort,9.7,khu_nghỉ_mát đẹp nhân_viên nhiệt_tình buffet ok,1,1,0,0,2
Le T. H.,Đà Nẵng,Khu nghỉ dưỡng Melia Đà Nẵng Beach,10.0,phòng_ốc thoải_mái dịch_vụ tốt,1,1,0,0,2
Thi T. H. L.,Phan Thiết,Hai Yen Family Resort,8.5,2 hải yên tòa màu trắng bể_bơi biển đẹp giá mắc tòa đối_diện hồ bơi không_đẹp kia chụp ảnh nha,0,1,0,1,1
Nguyen P. T.,Vũng Tàu,Khu nghỉ dưỡng Seava Hồ Tràm,10.0,hài_lòng chuyến đi chất_lượng phục_vụ ok,1,0,0,0,2
Thi T. H. D.,Đà Lạt,K Boutique Hotel in Dalat,9.7,khách_sạn đi hoạt_động hạn_chế giá khung_cảnh vị_trí hợp_lý nha nhân_viên thân_thiện có_điều xe_hơi bất_tiện,1,1,0,1,2
Le T. T. H.,Nha Trang,Rex Hotel and Apartment,8.5,phòng đẹp nhân_viên thân_thiện tội khăn_tắm ố màu một_chút phòng ổn,1,1,0,0,2
Tran D. T.,Đà Nẵng,Khách sạn Four Points by Sheraton Đà Nẵng,10.0,tốt,0,0,0,0,2
Nguyen A. T.,Đà Nẵng,Angel Hotel Danang,9.1,nhân_viên thân_thiện bảo_vệ lễ_tân khách_sạn upgrade phòng miễn_phí phòng kê giường phụ hơi tuy_nhiên phòng điều_hòa cũ hơi nóng bí khách_sạn hỗ_trợ 1 quạt ok vị_trí biển thuận_tiện đồ ăn buffet hơi đơn_giản phù_hợp giá,1,1,0,1,2
Pham D. H.,Đà Lạt,Cereja Hotel & Resort Dalat,6.3,khu ồn trọ không_được nhắc_nhở sinh_hoạt ồn đêm nhà_vệ_sinh mùi ăn bình_thường tuy_nhiên nhân_viên dễ_thương,1,1,1,0,0
Nguyen T. T. H.,Đà Nẵng,Khu nghỉ dưỡng Furama Đà Nẵng,10.0,khu_nghỉ_mát phong_cách đông dương hơi cổ hợp già phòng_ốc tiện_nghi sạch_sẽ ban_công hơi muỗi cây_cối nhìn_chung ok nhân_viên ivivu nhiệt_tình,1,1,1,0,2
Nguyen T. H.,Hà Nội,Khách sạn Hanoi Sunshine,9.7,khách_sạn đẹp sạch_sẽ phố cổ nhân_viên nhiệt_tình thân_thiện xung_quanh khách_sạn đồ ăn ngon,1,1,1,1,2
Tran V. T.,Phan Thiết,Khu nghỉ dưỡng Muine Bay Phan Thiết,8.0,cảm_thấy hài_lòng chất_lượng dịch_vụ khách_sạn tuy_nhiên hơi địa_điểm vui_chơi dịch_vụ ivivu tốt hiếu,1,1,0,1,2
Nguyen K. T.,Phan Thiết,Phan Thiet Ocean Dunes Resort,10.0,chúng_tôi 1_kỳ nghỉ tuyệt_vời phan_thiet ocean dunes khu_nghỉ_mát,0,0,0,0,2
Tran D. K.,Phan Thiết,Sea Links Beach Villas Phan Thiết,9.0,chất_lượng khách_sạn tốt phòng đẹp sang_trọng,0,1,0,0,2
Nguyen M. T.,Phú Quốc,Khu nghỉ dưỡng Fusion Phú Quốc,10.0,hôm đầu trời mưa phòng thấm báo bộ_phận lễ_tân đổi phòng hài_lòng,1,1,0,0,2
Nguyen T. T. T.,Đà Lạt,Khách Sạn LADALAT,9.0,chuyến đi tốt cảm_ơn ivivu,0,0,0,0,2
Nguyen T. H. T.,Đà Lạt,Khách Sạn LADALAT,10.0,ladalat tốt nhân_viên khách_sạn nhanh_nhẹn tận_tình nhân_viên ivivu tư_vấn tốt,1,0,0,0,2
Li M. H.,Hà Nội,Ma Coeur Boutique Hotel,9.4,khách_sạn tuyệt_vời nhân_viên thân_thiện phòng đẹp nội_thất,1,1,0,0,2
Nguyen T. A. T.,Phú Quốc,Vinpearl Resort & Spa Phú Quốc,10.0,chuyến đi ok vui lắm ivivu hỗ_trợ nhiệt_tình tiếp_tục sử_dụng dịch_vụ ivivu,1,0,0,0,2
Tran V. H.,Đà Lạt,Cereja Hotel & Resort Dalat,6.7,tiếp_tân nhiệt_tình chất_lượng phục_vụ tốt phòng_ốc sạch_sẽ sang_trọng,1,1,0,0,1
Ngoc T. N.,Hạ Long,Khách sạn Mường Thanh Luxury Quảng Ninh,8.8,phòng_ốc ổn ăn không_ngon đồ,1,1,0,0,0
Hien H.,Quy Nhơn,O.Six Resort,4.9,bữa tệ gọi khu_nghỉ_mát nhà_vệ_sinh bẩn,1,0,1,0,0
Nguyen M. N.,Nha Trang,An Lâm Retreats Ninh Vân Bay,10.0,tuyệt_vời 1 chuyến đi dịch,0,0,0,0,2
Nguyen N. T.,Nha Trang,Rex Hotel and Apartment,8.5,phòng sạch_sẽ ổn nhà_tắm rộng_rãi,0,1,1,0,2
Nguyen D. N.,Vũng Tàu,Khu nghỉ dưỡng Holiday Inn Hồ Tràm,10.0,dịch_vụ khách_sạn hài_lòng nhân_viên ivivu hỗ_trợ nhiệt_tình,1,0,0,0,2
Tran T. T. T.,Vũng Tàu,Khu nghỉ dưỡng Holiday Inn Hồ Tràm,10.0,dịch_vụ khách_sạn hài_lòng hương hỗ_trợ nhiệt_tình sắp_xếp 1 nghỉ gia_đình 1 chuyến,1,0,0,0,2
Nguyen C. T.,Huế,Hong Thien 1 Hotel,5.2,vệ_sinh phòng không_được sạch_sẽ,0,0,1,0,0
Nguyen T. H. H.,Quy Nhơn,Casa Marina Resort,8.4,khung_cảnh đẹp thái_độ nhân_viên phục_vụ thân_thiện dễ_thương tận_tình vị_trí khu_nghỉ_mát trung_tâm quy_nhơn 13 km hơi bất_tiện đi_lại mua_sắm khu trung_tâm tiền taxi 200 k1 lượt bãi_tắm đá hơi dốc tí bằng_phẳng đá biển êm tắm ok đồ ăn nhà_hàng ngon hơi giá giặt ủi,1,0,0,1,1
Tran D. T.,Phan Thiết,Khu nghỉ dưỡng Muine Bay Phan Thiết,8.0,khu nghỉ_dưỡng trung_tâm tốt hồ bơi đông không_được tiền hạng phù_hợp ivivu tốt 910,1,1,1,1,2
Pham T. T.,Đà Nẵng,Meliã Vinpearl Đà Nẵng Riverfront,10.0,hài_lòng vinpearl chất_lượng,0,0,0,0,2
Phuong P.,Đà Nẵng,Khách sạn Royal Charm,8.5,khách_sạn ok nhân_viên lịch_sự thân_thiện,1,1,0,0,2
Nguyen H. V.,Vũng Tàu,Khách sạn Fusion Suites Vũng Tàu,10.0,dịch_vụ tốt,1,0,0,0,2
Thanh H.,Phan Thiết,Khu nghỉ dưỡng Pandanus Phan Thiết,10.0,cảm_ơn pandanus kỳ nghỉ tuyệt_vời,0,0,0,0,2
Tran T. T. L.,Phan Thiết,Victoria Phan Thiết Beach Resort & Spa,10.0,phòng_ốc ok nhân_viên dễ_thương nhiệt_tình tiếc một_chút không_tắm bãi biển khu_nghỉ_mát cải_tạo biển hạn_chế đá ăn_uống ok giá phụ_thu hơi gửi cảm_ơn mi nhân_viên tư_vấn ivivu nha,1,1,0,1,2
Luong T. H.,Huế,Phong Nha Hotel Hue,10.0,khách_sạn tốt sạch_sẽ bữa ngon_miệng phục_vụ nhiệt_tình,1,1,1,0,2
Tran T. H.,Phú Quốc,Vinpearl Discovery Wonderworld Phú Quốc,8.0,khách_sạn ok tốt nhận_phòng hơi 2 biệt_thự chảy hơi yếu ok không_sao diễm hương tư_vấn tận_tình xem_lại lịch_sử biệt_thự hơi to gia_đình tư_vấn 1 biệt_thự phòng vừa_ý hài_lòng đánh_giá 5 5 tư_vấn,1,1,0,0,2
Do V. H.,Đà Nẵng,Khách sạn Royal Charm,9.7,phòng đẹp hình ban_công thoáng mát nhân_viên nhiệt_tình niềm nở trở_lại,1,1,0,0,2
Nguyen M. L.,Đà Nẵng,Khách sạn A La Carte Đà Nẵng,10.0,vị_trí khách_sạn dịch_vụ khách_sạn tốt nhân_viên nhiệt_tình không_phàn_nàn khách_sạn hài_lòng phòng khách_sạn,1,0,0,1,2
Nguyen T. B. T.,Hà Nội,MK Premier Boutique Hotel,8.5,phòng sạch_sẽ nhân_viên thân_thiện ăn ngon,1,0,1,0,2
Nguyen T. D.,Nha Trang,An Lâm Retreats Ninh Vân Bay,10.0,giá ivivu tốt giá_cả ok nhân_viên chăm_sóc tốt khách_sạn vô_cùng hài_lòng không_thấy vấn_đề,1,1,0,0,2
Bui T. T.,Nha Trang,Khu nghỉ dưỡng Amiana Nha Trang,10.0,tuyệt_vời,0,0,0,0,2
Nguyen T. T. T.,Vũng Tàu,Khách sạn Fusion Suites Vũng Tàu,10.0,tốt,0,0,0,0,2
Thu L.,Hà Nội,Ma Coeur Boutique Hotel,9.7,phòng hồ khung_cảnh đẹp khung_cảnh hồ nhân_viên nhiệt_tình chu_đáo vị_trí trung_tâm ăn_uống khách_sạn tiện ngon,1,0,0,1,2
Nguyen T. P. T.,Nha Trang,An Lâm Retreats Ninh Vân Bay,10.0,cảm_ơn ivivu an_lâm retreat nimh vân bay kỳ nghỉ tuyệt_vời kỷ_niệm,0,0,0,0,2
Nguyen T. H. Y.,Nha Trang,Rex Hotel and Apartment,5.1,tệ không_thể chấp_nhận khách_sạn tự_ý gom đồ đi,1,0,0,0,0
Nguyen T. T.,Vũng Tàu,Khu nghỉ dưỡng Six Senses Côn Đảo,9.0,tốt,0,0,0,0,2
Nguyen T. D.,Hội An,Khách sạn Thanh Bình 2,8.5,phòng sạch_đẹp vị_trí trung_tâm phố cổ nhân_viên thân_thiện,1,1,0,1,2
Ngoc A.,Đà Nẵng,Lotus Rock Hotel,5.5,thang_máy hư gia_đình kẹt có_vẻ tình_trạng thường_xuyên xảy xử_lý khách_sạn tệ không_hỏi_han mà_còn quát ồn_ào,1,1,0,0,0
Nguyen T. M. H.,Phan Thiết,Khách sạn Sea Links Beach Phan Thiết,10.0,sea links cảnh xung_quanh đẹp hồ bơi ok nhân_viên nhiệt_tình chu_đáo lắm,1,0,0,1,2
Tran T. T. N.,Vũng Tàu,Minera Hot Springs Bình Châu (Khoáng Nóng Thiên Nhiên Bình Châu),10.0,gia_đình kỳ nghỉ vui_vẻ,0,0,0,0,2
Nguyen T. T. T.,Nha Trang,Khu nghỉ dưỡng The Anam Nha Trang,10.0,chuyến đi tốt_đẹp,0,0,0,0,2
Mai A.,Hồ Chí Minh,Khách sạn Cozrum Smart - First Target,5.5,lễ_tân tệ đi khách_sạn cảm_thấy sợ lễ_tân,1,0,0,0,0
Nguyen H. H.,Phan Thiết,Seahorse Resort & Spa Phan Thiết,10.0,khu_nghỉ_mát đẹp nhân_viên phục_vụ chu_đáo hơi côn_trùng hài_lòng phục_vụ khu_nghỉ_mát,1,1,1,0,2
Le T. T.,Phan Thiết,Khu nghỉ dưỡng Pandanus Phan Thiết,10.0,cảnh_quan tốt phòng sạch_sẽ ngăn_nắp chuyến đi tốt vui_vẻ,0,0,1,1,2
Tran T. T.,Nha Trang,Khu nghỉ dưỡng Amiana Nha Trang,10.0,liễu nhân_viên ivivu hỗ_trợ nhiệt_tình quá_trình phòng đổi phòng hoàn phí yên_tâm khu_nghỉ_mát đẹp biển cát mịn hồ bơi sạch ăn chủng âu anh_chị nhân_viên nhiệt_tình dễ_thương trả_phòng có_thể hơi tùy tình_hình khách_sạn,1,0,1,1,2
Nguyen T.,Hồ Chí Minh,Ruby Saigon Hotel,9.1,chấp_nhận giá,0,0,0,0,1
Nguyen T. T. T.,Đà Nẵng,Khu nghỉ dưỡng Núi Thần Tài Ebisu Đà Nẵng,9.5,dịch_vụ phòng_ốc ok tốt,1,1,1,0,2
Li M. H.,Hà Nội,Ma Coeur Boutique Hotel,9.4,khách_sạn đẹp trung_tâm phố cổ nhân_viên tận_tình chu_đáo ăn,1,1,0,1,2
Nguyen T. H.,Vũng Tàu,Minera Hot Springs Bình Châu (Khoáng Nóng Thiên Nhiên Bình Châu),8.0,phòng hơi cũ thức_ăn bình_thường không_có phong_phú lắm nói_chung không_có than_phiền đội_ngũ làm_việc khách_sạn ivivu,1,1,0,0,1
Truong T. T.,Phan Thiết,Sea Links Beach Villas Phan Thiết,9.0,khách_sạn phòng rộng_rãi đầy_đủ tiện_nghi dịch_vụ chu_đáo,1,1,0,0,2
Ngo T. T. D.,Nha Trang,Aroma Nha Trang Boutique Hotel,8.5,khách_sạn hơi cũ giá phải_chăng biển,0,1,0,1,1
Tran T. V.,Quy Nhơn,Muong Thanh Quy Nhon Hotel,9.7,nhân_viên khách_sạn nhẹ_nhàng lịch_sự,1,0,0,0,2
Doan T. T.,Nha Trang,Khu nghỉ dưỡng Vinpearl Nha Trang,10.0,phòng hơi cận đi nhân_viên tư_vấn báo đi tàu_hỏa hậu_quả mất_ngủ không_quen đi tàu ban_đêm chuyến phòng đi máy_bay kinh_nghiệm đi không_quen đi tàu đi máy_bay,1,0,0,0,1
Quynh T.,Hà Nội,Hanoi Charming House,9.4,phòng sạch_sẽ ấm_cúng dịch_vụ tốt,1,0,1,0,2
Le T. T. T.,Vũng Tàu,Khu nghỉ dưỡng Seava Hồ Tràm,6.0,vị_trí khách_sạn nằm mặt đường thuận_lợi đi_lại phục_vụ phòng không_thân thiện lắm phòng 2 diện_tích hơi chật đồ_ăn đắt không_được ngon nhân_viên tư_vấn ivivu nhiệt_tình nhanh_chóng,1,0,0,1,1
Nguyen H. V.,Đà Nẵng,The Garden Hotel and Apartment,8.5,đầu trải_nghiệm mưa_bão đà nẵng thế_nào cải_thiện cách_âm phòng ok,1,1,1,0,1
Thi T. H. V.,Đà Nẵng,Khách sạn Brown Bean,9.1,phòng 2 nhân_viên khách_sạn nhiệt_tình vị_trí khách_sạn thuận_tiện di_chuyển khu_vực vui_chơi giá_cả ổn hợp_lý,1,1,0,1,1
Tran T. N. H.,Nha Trang,Khách sạn Senkotel Nha Trang,6.0,đột_xuất không_đi không_hề gọi phòng không,1,0,0,0,0
Nguyen T. T. H.,Vũng Tàu,Oceanami Villas & Beach Club,6.1,phòng_ốc không_sạch_sẽ bữa ok,1,0,1,0,1
Tran T. A.,Đà Nẵng,Khách sạn Royal Charm,6.2,phòng đặt_giá rẻ 450 k đêm thời_điểm dịch corona cửa nhà_vệ_sinh hỏng không_chốt đi thật_sự bất_tiện cửa khe rộng xuyên phòng cách_âm tệ nói_chuyện vệ_sinh bình_thường ăn tạm ổn giường,1,1,1,0,0
Nguyen T. V.,Hà Nội,New Style House Hotel,8.9,phòng bé thoáng giường bụi tóc nhân_viên không_thân_thiện lắm,1,1,1,0,0
Nguyen D. K.,Hạ Long,City Bay Palace Hotel,9.4,ổn,1,1,1,0,1
Nguyen T. T. T.,Nha Trang,Rex Hotel and Apartment,8.5,rex quen 2 rex phòng y hình sạch_sẽ thoải_mái cập_nhật phòng app không_chuẩn chủ_định phòng sup đôi hạn phòng phòng 3 ban_công rộng_rãi gấp đôi ban_ngày ánh_sáng rèm che không_hết,1,1,1,0,1
Tran T. N. H.,Quy Nhơn,Mento Hotel Quy Nhon,9.7,khách_sạn sạch_sẽ đẹp nhân_viên nhiệt_tình dễ_thương,1,1,1,0,2
Nguyen T. T.,Phan Thiết,Khách sạn Sea Links Beach Phan Thiết,10.0,hài_lòng chất_lượng dịch_vụ khách_sạn nhân_viên hỗ_trợ tốt đầy_đủ thông_tin cảm_ơn ivivu,1,1,0,0,2
Pham T. T. H.,Huế,Phong Nha Hotel Hue,8.5,tất_cả ổn khách_sạn vị_trí trung_tâm,1,1,1,1,1
Nguyen X. T.,Vũng Tàu,Khu nghỉ dưỡng Seava Hồ Tràm,8.0,cơ_sở_vật_chất cảnh_quan khách_sạn tương_đối tốt tuy_nhiên một_số cải_thiện lễ_tân khách_sạn lúng_túng nhận_phòng không_báo bộ_phận buồng phòng vệ_sinh trả_phòng lễ_tân xác_nhận xong bộ_phận buồng phòng đợi mặt 15 phút nhắc vội giấy_tờ hồ bơi bẩn cặn bẩn lửng_lơ lắng đáy hồ,1,1,1,1,0
Nguyen H.,Nha Trang,Vinpearl Condotel Beachfront Nha Trang,10.0,đánh_giá chất_lượng dịch_vụ ivivu trải_nghiệm tuyệt_vời vinpearl nha trang cảm_ơn ivivu hy_vọng cơ_hội trải_nghiệm chuyến đi nghỉ dưỡng ivivu cung_cấp,1,0,0,0,2
Pham T. M. L.,Hạ Long,Ivy Hotel - Ha Long,6.0,giá thuê xe niêm_yết phòng 120 150 k quầy lễ_tân 200 k mà_còn 20 k tiền xăng không_như thỏa_thuận ban_đầu,1,0,0,0,0
Nguyen T. H.,Hội An,Thanh Binh Central Hotel,8.7,phòng khách_sạn ổn nhà_vệ_sinh_thiết_bị cũ không_được sạch_sẽ cửa_sổ bụi bẩn vô_cùng đệm giường rộng êm,0,1,1,0,0
Ngoc N.,Huế,Phong Nha Hotel Hue,8.5,thoải_mái sạch_sẽ đẹp rộng thoáng,0,1,1,0,2
Nguyen T. B. T.,Hà Nội,Khách sạn Hanoi Sunshine,10.0,tuyệt_vời nhân_viên thân_thiện dễ_thương nhất_định,1,0,0,0,2
Thi M. P. N.,Nha Trang,Rex Hotel and Apartment,9.7,khách_sạn nhận_phòng 14 phòng trống phòng rộng_rãi sạch_sẽ ban_công thích_hợp gia_đình bé_nhỏ nằm trung_tâm tạp_hóa quán cafe không_thấy quán ăn mấy,1,1,1,1,2
Nguyen D. K.,Nha Trang,Khu nghỉ dưỡng Amiana Nha Trang,10.0,đầu đập hộp 1 mới_toanh chất_lượng xịn sò đẹp mê_ly khung_cảnh khuôn_viên khu_nghỉ_mát nội_thất biệt_thự,0,1,0,1,2
Nguyen T. M. P.,Phan Thiết,Seahorse Resort & Spa Phan Thiết,10.0,trải 2 đêm khách_sạn sea horse tốt nhân_viên ivivu giúp tận_tình_cảm_ơn,1,1,1,0,2
Nguyen T. H. T.,Phan Thiết,Khách sạn Sea Links Beach Phan Thiết,10.0,khách_sạn đẹp nhân_viên niềm nở buffet hoành_tráng dịch_vụ 5,1,1,0,0,2
Le H. N.,Huế,Phong Nha Hotel Hue,8.8,tuyệt_vời giá không_có thang_máy cửa khăn cũ đối_với không_thành vấn_đề vì_vậy trở_lại,0,1,0,0,1
Nguyen M. P.,Phan Thiết,Khu nghỉ dưỡng Pandanus Phan Thiết,10.0,phòng_ốc dịch_vụ tốt chuyến đi lắm giới_thiệu bạn_bè ivivu làm_việc chu_đáo hài_lòng,1,0,0,0,2
Nguyen V. H.,Nha Trang,Khu nghỉ dưỡng Amiana Nha Trang,10.0,thoải_mái sạch_sẽ chuyên_nghiệp,1,1,1,0,2
Nguyen T. T. T.,Nha Trang,Khu nghỉ dưỡng Movenpick Cam Ranh,10.0,tất_cả dịch_vụ tốt phòng sạch_sẽ nhân_viên vui_vẻ nhiệt_tình phục_vụ nhận_phòng muộn trả_phòng khu vui_chơi thích_hợp gia_đình nhất_định,1,0,1,1,2
Nguyen T. T. H.,Phú Quốc,The Palmy Phú Quốc Resort & Spa,10.0,khách_sạn sạch_sẽ yên_tĩnh nhân_viên nhiệt_tình hồ bơi biển tuyệt đẹp cơ_hội,1,0,1,1,2
Tran T. N.,Phan Thiết,Seahorse Resort & Spa Phan Thiết,8.0,biển hồ bơi đẹp muỗi khách_sạn bố_trí dầu_dưỡng muỗi tốt,0,1,1,1,1
Thanh H.,Nha Trang,Khách sạn Mường Thanh Luxury Khánh Hòa,9.1,phòng rộng đẹp miêu_tả nhân_viên nhiệt_tình,1,1,0,0,2
Le Q. H.,Phú Quốc,Muong Thanh Luxury Phu Quoc Hotel,9.7,nhân_viên chu_đáo lịch_sự phòng đẹp sạch_sẽ,1,1,1,0,2
Nguyen T. K.,Phan Thiết,Khách sạn Sea Links Beach Phan Thiết,9.0,không_phàn_nàn khách_sạn tốt,1,1,1,0,2
Ngo T. T.,Phú Quốc,VinOasis Phu Quoc,9.7,dịch_vụ tốt đồ ăn ngon phòng đẹp,1,1,0,0,2
Nguyen T. N.,Vũng Tàu,Khách sạn Fusion Suites Vũng Tàu,10.0,nhân_viên thân_thiện liệu trình mát_xa thoải_mái lắm phòng tiện_nghi hồ bơi nhân_viên khách_sạn lịch_sự nhẹ_nhàng,1,1,0,0,2
Nguyen T. T. N.,Quy Nhơn,Khu nghỉ dưỡng Crown Retreat Quy Nhơn,9.5,phòng_ốc dịch_vụ ok hài_lòng,1,1,0,0,2
Tran H. N.,Nha Trang,Khu nghỉ dưỡng Vinpearl Nha Trang,9.5,dịch_vụ vinpearl tốt mặc_dù thay_đổi địa_điểm đi ivivu hỗ_trợ tốt chu_đáo,1,0,0,0,2
Nguyen V. H.,Đà Nẵng,Khách sạn A La Carte Đà Nẵng,9.0,dịch_vụ khách_sạn tốt không_có_gì chê nhân_viên ivivu tư_vấn nhiệt_tình chu_đáo ivivu,1,0,0,0,2
Oanh O.,Quy Nhơn,AVANI Quy Nhon Resort and Spa,9.7,khu_nghỉ_mát phòng_ốc khung_cảnh bờ biển đẹp nhân_viên phục_vụ dễ_thương,1,1,0,1,2
Tran T. T. T.,Đà Nẵng,Khách sạn Four Points by Sheraton Đà Nẵng,10.0,chuyến đi tốt ổn,1,1,1,0,2
